{
  "strike_reference": "Strike-Test-ACK-001",
  "case_title": "Acknowledged complaint without follow-through",
  "civic_domain": "local_government",
  "decision_trigger": "Complaint acknowledged but no substantive action followed.",
  "recall_question": "What happens when acknowledgement is provided without action?",
  "user_priority": "resolution",
  "desired_outcome": "A substantive response and evidence-based next step",
  "urgency": "medium",
  "institutions": [
    "Public Body",
    "Oversight Body"
  ],
  "case_lifecycle": {
    "current_stage": "awaiting_response",
    "status": "active",
    "stalled": false,
    "days_open": 14,
    "next_decision_point": "assess_internal_deadline_expiry",
    "next_deadline": "2026-04-15",
    "recommended_mode": "hold_and_prepare"
  },
  "rules_or_procedures": [
    "Complaint handling procedure",
    "Response window of 20 working days",
    "External escalation route after internal process delay"
  ],
  "constraints": [
    "Delay",
    "No substantive follow-up",
    "Need to preserve an accurate chronology"
  ],
  "actors": [
    {
      "name": "Complainant",
      "actor_type": "individual",
      "role_in_case": "initiating and documenting the complaint",
      "incentive_or_pressure": "seeking substantive response and clarity",
      "likely_behaviour": "preserve records, follow up, and escalate if necessary"
    },
    {
      "name": "Administrative Office",
      "actor_type": "institutional_actor",
      "role_in_case": "receiving and processing the complaint",
      "incentive_or_pressure": "manage workload and reduce procedural exposure",
      "likely_behaviour": "acknowledge receipt but delay substantive engagement"
    },
    {
      "name": "Oversight Reviewer",
      "actor_type": "oversight_actor",
      "role_in_case": "reviewing the complaint if escalation occurs",
      "incentive_or_pressure": "remain within remit and evidential thresholds",
      "likely_behaviour": "request chronology and supporting records before progressing"
    }
  ],
  "evidence_bundle": [
    {
      "label": "Initial complaint email",
      "evidence_type": "email",
      "relevance": "Shows when the complaint was first submitted",
      "strength": "high",
      "linked_timeline_label": "Complaint submitted"
    },
    {
      "label": "Acknowledgement email",
      "evidence_type": "email",
      "relevance": "Confirms receipt of complaint without substantive action",
      "strength": "high",
      "linked_timeline_label": "Acknowledgement received"
    },
    {
      "label": "Follow-up note",
      "evidence_type": "note",
      "relevance": "Records absence of substantive response after acknowledgement",
      "strength": "medium",
      "linked_timeline_label": "No substantive action"
    }
  ],
  "deadlines": [
    {
      "label": "Internal response deadline",
      "due_date": "2026-04-15",
      "consequence": "Missed deadline strengthens basis for escalation"
    }
  ],
  "timeline": [
    {
      "event_date": "2026-04-01",
      "label": "Complaint submitted",
      "event_type": "submission",
      "description": "Formal complaint submitted to the institution."
    },
    {
      "event_date": "2026-04-02",
      "label": "Acknowledgement received",
      "event_type": "acknowledgement",
      "description": "Institution acknowledged receipt of the complaint."
    },
    {
      "event_date": "2026-04-15",
      "label": "No substantive action",
      "event_type": "delay",
      "description": "No substantive response or action followed acknowledgement."
    }
  ],
  "escalation_paths": [
    {
      "name": "Internal procedural follow-up",
      "route_type": "internal_complaint",
      "trigger": "No substantive response after acknowledgement",
      "likely_response": "A narrow reply or further delay",
      "time_horizon": "short",
      "risk_level": "low",
      "jurisdiction_fit": "yes",
      "evidence_readiness": "high",
      "deadline_pressure": "medium",
      "outcome_status": "unknown",
      "outcome_note": ""
    },
    {
      "name": "External oversight escalation",
      "route_type": "oversight_review",
      "trigger": "Internal route appears stalled or exhausted",
      "likely_response": "Request for chronology and evidence bundle",
      "time_horizon": "medium",
      "risk_level": "medium",
      "jurisdiction_fit": "partial",
      "evidence_readiness": "high",
      "deadline_pressure": "low",
      "outcome_status": "unknown",
      "outcome_note": ""
    }
  ],
  "linked_cases": [
    {
      "strike_reference": "Strike-Reference-Prev-001",
      "relationship_type": "same_institution",
      "note": "Earlier complaint involving delay by the same body"
    }
  ],
  "structural_insight": "Acknowledgement without substantive action can create the appearance of engagement while resolution does not progress.",
  "personal_positioning": "The complainant is waiting for a substantive response while preserving a clear record.",
  "decision_note": "Preserve chronology, wait for deadline expiry, then escalate if no substantive reply appears.",
  "learning_capture": "Acknowledgement is not the same as action."
}